{
  "$schema": "https://json-schema.org/draft/2020-12/schema",
  "$id": "https://sentinel-shield/schemas/profile.manifest.schema.json",
  "title": "Sentinel Shield profile manifest",
  "description": "Declares the files a profile installs/syncs into a consuming project. Consumed by scripts/install-baseline.sh and scripts/sync-baseline.sh (v0.1.11+).",
  "type": "object",
  "required": [
    "profile",
    "files"
  ],
  "additionalProperties": true,
  "properties": {
    "profile": {
      "type": "string",
      "minLength": 1
    },
    "description": {
      "type": "string"
    },
    "stacks": {
      "type": "array",
      "items": {
        "type": "string"
      }
    },
    "files": {
      "$ref": "#/$defs/entryList"
    },
    "workflows": {
      "$ref": "#/$defs/entryList"
    },
    "docs": {
      "$ref": "#/$defs/entryList"
    },
    "never_touch": {
      "type": "array",
      "items": {
        "type": "string"
      },
      "description": "Project-local paths the installer/sync MUST never create or overwrite (e.g. accepted-risks.json, phpstan-baseline.neon)."
    },
    "required_scripts": {
      "type": "array",
      "items": {
        "type": "string"
      },
      "description": "Upstream Sentinel Shield scripts the installed workflow calls (informational; they live in Sentinel Shield, not copied)."
    },
    "recommended_raw_reports": {
      "type": "array",
      "items": {
        "type": "string"
      }
    },
    "tool_policy_version": {
      "type": "integer",
      "const": 2,
      "description": "Supported tool-policy schema version. Only 2 is supported in this rollout; other values fail validation."
    },
    "extends": {
      "type": "array",
      "items": {
        "type": "string",
        "pattern": "^[a-z0-9][a-z0-9-]*$",
        "description": "A safe profile identifier (lowercase, digits, hyphens) \u2014 no whitespace, path separators, or traversal."
      },
      "description": "Base profile names whose tool policies this profile composes (resolved by the canonical resolver)."
    },
    "tools": {
      "$ref": "../schemas/tool-policy.schema.json#/$defs/toolsMap",
      "description": "Per-tool policy declarations (key = TOOL_TABLE key). See schemas/tool-policy.schema.json and docs/profile-tool-policy.md."
    }
  },
  "$defs": {
    "entryList": {
      "type": "array",
      "items": {
        "type": "object",
        "required": [
          "source",
          "target",
          "mode"
        ],
        "additionalProperties": false,
        "properties": {
          "source": {
            "type": "string",
            "description": "Path relative to the Sentinel Shield repo root."
          },
          "target": {
            "type": "string",
            "description": "Path relative to the consuming project root."
          },
          "mode": {
            "type": "string",
            "enum": [
              "create-if-missing",
              "merge-required-lines",
              "overwrite-if-force",
              "sync-managed-block",
              "manual"
            ],
            "description": "create-if-missing: write only if absent (project owns it after). merge-required-lines: project-owned, but every non-comment line of the source is REQUIRED — an existing file keeps its own entries and the missing required lines are appended (idempotent). overwrite-if-force: managed; create if absent, overwrite only with --force. sync-managed-block: managed marker block updated in place (reserved). manual: never auto-written; printed for the maintainer to handle."
          }
        }
      }
    }
  }
}
