{
  "$schema": "../../../../profiles/profile.manifest.schema.json",
  "profile": "ps-composed",
  "description": "Composed-semantics negative fixture:\u6bcf manifest is individually valid; the defect only exists after inheritance is merged.",
  "tool_policy_version": 2,
  "files": [],
  "tools": {
    "pest": {
      "policy": "one-of",
      "alternatives": [
        "phpunit"
      ],
      "execution": {
        "pr": true,
        "main": true,
        "scheduled": false
      }
    },
    "phpunit": {
      "policy": "one-of",
      "alternatives": [
        "pest"
      ],
      "execution": {
        "pr": true,
        "main": true,
        "scheduled": false
      }
    }
  }
}
